{
  "schema_version": "1.0.0",
  "platform": "x",
  "connector_id": "conn_x_observe_001",
  "account_id": "acct_hermes_public",
  "display_name": "HERMES Public",
  "connector_type": "native_api",
  "permissions": {"observe": true, "analyze": false, "draft": false, "execute": false},
  "status": "approved_read_only",
  "rate_limit_profile": "x_standard",
  "budget_profile": null,
  "credential_handle": "handle:x-observe-001",
  "retention_class": "standard",
  "created_at": "2026-08-06T18:00:00Z",
  "updated_at": "2026-08-06T18:00:00Z"
}
